id;author;score;body;subreddit;created_utc
gr94phx;AG42069;0;So very very vague. I personally believe BB will trade at $5-$200 within the next 2-45 years;stocks;2021-03-17 16:39:28
gr942wu;worsethanwetsocks;2;cruise control bb;wallstreetbets;2021-03-17 16:34:50
gr93o7p;derprondo;1;Long term plays:  RYCEY, GOEV, BB;wallstreetbets;2021-03-17 16:31:49
gr92ysj;BeagleBackRibs;1;Did you buy when the stock was at $28? I'm up on all my BB calls for Jan 23;wallstreetbets;2021-03-17 16:26:36
gr92rru;jekylczar;10;BB you ignorant slut;wallstreetbets;2021-03-17 16:25:09
gr92gmg;LMD_AU;2;GME RKT BB PLTR AMC TSLA;wallstreetbets;2021-03-17 16:22:52
gr90vci;Tradergurue;-1;BB earnings report 30th of March 🏎🏎🏎;wallstreetbets;2021-03-17 16:11:06
gr8yomf;sham3shame3;4;Oh fuck yeah, keep talking bb;wallstreetbets;2021-03-17 15:55:05
gr8yf4s;dkphxcyke;2;4 @ 218 for me too bb;wallstreetbets;2021-03-17 15:53:08
gr8yaoe;skipx603;1;I killed it off nio, TSLA, bb, pltr, gme and aapl late Jan and god it was fun;wallstreetbets;2021-03-17 15:52:13
gr8x2ku;tmaxhhansen;1;APPL BB and NOK;wallstreetbets;2021-03-17 15:43:09
gr8wuxi;Uteemba;1;Brooks Brothers is the og BB;wallstreetbets;2021-03-17 15:41:34
gr8vvsa;Zestyclose_Way_9109;1;And BB and PLTR and probably all of the meme stocks.;wallstreetbets;2021-03-17 15:34:18
gr8v7kp;Im_Old_In_Town;3;BB green by EOD;wallstreetbets;2021-03-17 15:29:15
gr8ur47;dreadfulol;3;I have stopped. The first sells were before I knew what the hell was going on. Then the 15 share sell was actually an accident. I meant to buy, so I bought 60 right after to compensate. I did have a paper hand moment at 148 on March 10th and put it into BB and I'm not proud of that. Since then I sold BB and put it all back into GME on that flash crash on March 10th. Holding from now on! I apologize.;wallstreetbets;2021-03-17 15:25:49
gr8um89;Zestyclose_Way_9109;1;GME, AMC, BB and PLTR charts are all looking the same. Probs all the meme stocks.;wallstreetbets;2021-03-17 15:24:48
gr8um4n;MoonHunterDancer;1;it looks like they were in the same deaths spiral portfolio as gme, along with BB and Nok, but of the 4 i feel like it is like this: RC likes keeping his customers (us) happy, AMC ceo likes keeping his corporate investors happy (not us), BB likes keeping things secure (only us because the Pentagon seems to have given them a amex black equivalent to secure their comps and phones and amazon and others are looking to them now, too), and Nok apparently just got some sort of deal for something? honestly i think amazon is going to eat them. so as an individual gme is the best, with BB having a good long term, especially if they become the security tech equivalent of LMT. The AMC CEO needs to have a face to face with their retail investors...;wallstreetbets;2021-03-17 15:24:46
gr8tsfk;colettik;1;Diamond hands bb;wallstreetbets;2021-03-17 15:18:22
gr8s4dv;javeliner10000;1;Good ole anti good news BB strikes again;wallstreetbets;2021-03-17 15:05:21
gr8pjn1;Historical_Baker_137;1;sleep tight bb;wallstreetbets;2021-03-17 14:44:56
gr8omgm;crumbycanadianpoutin;1;Every time good news drops about BB their P/S drops by at least 1%;wallstreetbets;2021-03-17 14:37:30
gr8om6k;QuarantineSucksALot;1;Hmmm, someone just bought $12 million in BB;wallstreetbets;2021-03-17 14:37:26
gr8nmz1;Jasond777;1;Good to see bb is coming back!;wallstreetbets;2021-03-17 14:29:23
gr8mbdk;spactank;1;Did i just read, buy and hold more $BB?💎🤲🦍💪;wallstreetbets;2021-03-17 14:18:36
gr8lufl;somethingesque;1;"can we stomp BB shorts now. i don't understand the movements. good news &gt; tank";wallstreetbets;2021-03-17 14:14:41
gr8l5zk;JuanJazz123;1;BB refuses to go up even with positive news as well;wallstreetbets;2021-03-17 14:09:01
gr8khv9;TheToli;1;BB To $13 today , heard it here folks , check in with me EOD and let’s see if I’m right;wallstreetbets;2021-03-17 14:03:17
gr8jevj;Matthewj580;1;Any long term looks on BB? Got in on the hype bought at 9, 13, 17. Waiting to  remake my money ATM.;wallstreetbets;2021-03-17 13:53:59
gr8j96c;_pureguava;1;"what you buying today?
Im thinkin AAPL, MSFT, maybe ArKF/G, BB, shroom stocks, BTC";stocks;2021-03-17 13:52:37
gr8hkhr;ParzivalVonUbermench;1;Not yet bb;wallstreetbets;2021-03-17 13:37:57
gr8heyc;worsethanwetsocks;1;"$2 gaps on bid/ask

Liquidity drying the fuck up bb";wallstreetbets;2021-03-17 13:36:37
gr8h4rx;Individual_Stomach40;1;Biden Bucks? BB? Haha nice;wallstreetbets;2021-03-17 13:34:00
gr8g820;leredditbugman;1;NOK and bb aren’t memestocks when memestocks are mooning but are memestocks when memestocks are tanking. The infamous double donged dildo pattern🤔;wallstreetbets;2021-03-17 13:25:49
gr8fm3f;WoOoOoOoShHhHh;1;BB 😔;wallstreetbets;2021-03-17 13:20:13
gr8fl6j;GoJa_official;1;No, I hate juice. Juice boxes are for pussies and plotkin is one of em. capri sun all day bb;wallstreetbets;2021-03-17 13:19:59
gr8euh4;soyeahiknow;1;It's not too bad. I've been doing it for a while but have missed out on huge gains when my stocks got called away like gme, bb, plug.;stocks;2021-03-17 13:13:07
gr8ecl9;angrypanda111;1;I have 255 shares at 10.  At least when I yolo ed on bb I got to enjoy it at 20 for a brief period. Uwmc hurts all the time man.;wallstreetbets;2021-03-17 13:08:20
gr8a2bo;winethemantyler01;1;I adopted BB;wallstreetbets;2021-03-17 12:24:07
gr89pd4;Im_Old_In_Town;1;Because I believe BB will be huge in the next year or two.;wallstreetbets;2021-03-17 12:20:04
gr89nce;oaklandriot;1;Join the bear side bb;wallstreetbets;2021-03-17 12:19:26
gr89j40;Im_Old_In_Town;1;BB dips. I buy more BB.;wallstreetbets;2021-03-17 12:18:06
gr89ac7;Chubbymcgrubby;1;Bb is still hot it's just a 2 year play so yea bags for most for a bit but long term sexy;wallstreetbets;2021-03-17 12:15:19
gr894ro;derprondo;1;"**Bullish:**

VALE

RYCEY

GOEV

CRLBF

GME

**Bearish:**

AMC

**Bag holding:**

ARK*

BB

HYLN

VRNOF";wallstreetbets;2021-03-17 12:13:32
gr88b2z;the-walkman8;1;BB needs to release some bad news.  Maybe involve some hookers to make it fun.  Stonk would moon;wallstreetbets;2021-03-17 12:03:51
gr8897p;clickkclackk;1;BB;wallstreetbets;2021-03-17 12:03:14
gr884ve;Eszrah;1;At any price under 10 I think BB is a steal, I had 100 shares but miscalculated a covered call and sold at 10.50, would have liked to have the shares longer.;stocks;2021-03-17 12:01:46
gr87zzw;toeofcamell;1;I have lots of GME and amc and BB;wallstreetbets;2021-03-17 12:00:08
gr87u0z;the-walkman8;1;Hey BB, why do you have to get my hopes at the beginning of the week, only to release good news yesterday?  Everyone knows you drop on good news.;wallstreetbets;2021-03-17 11:58:05
gr873zd;Ready2gambleboomer;1;BB bag holder checking in.  But you retards are coming back for me right?;wallstreetbets;2021-03-17 11:49:07
gr873bz;magharees;1;"AMC came out of nowhere to muddy the waters and dilute focus, just like Nokia.

Originally it was GME and BB to choose from pre-Jan 2021, then lots of AMC/NOK spaming &amp; eventually a muffling of anything that was not GME because the wsb mods were into GME only.  They should have allowed BB to fly";wallstreetbets;2021-03-17 11:48:54
gr85mk7;Investorian;1;I had a dream I should invest into nok and bb.. but then I woke up and realized dreams are for pussies and the real dream is my gme shares going to the moon;wallstreetbets;2021-03-17 11:29:59
gr85jl9;Flip__Side;1;Why not just spend less on LEAPs? You could spend less and still stand to gain the same. I believe BB has leaps for 2023;wallstreetbets;2021-03-17 11:28:53
gr855fn;Ic0n1k;1;Webull also restricted trading on GME AMC BB etc. a few weeks back, and is a Chinese company likely doing some shady shit with your trading/personal/banking information;wallstreetbets;2021-03-17 11:23:33
gr84pn0;Vayu0;1;It will most likely be Burgundy. I mean the wine I'll be drinking due to the constant red I see everyday on BB.;stocks;2021-03-17 11:17:29
gr83xjh;Zealousllyideal_777;1;BB had its autonomous vehicle patent approved... and its still red PM 😅;wallstreetbets;2021-03-17 11:06:14
gr819uq;Tradergurue;1;Stimmy going straight into BB 🚀;wallstreetbets;2021-03-17 10:24:49
gr80lu1;Cashmere_Cowboy;1;Your data must be stale. I got 10% from BB. Where are you looking?;stocks;2021-03-17 10:13:41
gr7xz7q;Fistijack61;1;#GME AMC BB 🚀;wallstreetbets;2021-03-17 09:28:20
gr7x1yj;Redditerino77;1;Well using the info I gathered from comments about BB any good news brings the stocks down and bad news brings it down so I predict it will go down;stocks;2021-03-17 09:11:46
gr7vjtb;mn_my;1;Hey don't put BB in with the rest there that's at least a decent play;wallstreetbets;2021-03-17 08:44:55
gr7v70t;LifeSizedPikachu;1;I wonder if I should antagonize GME or AMC or BB holders for tomorrow... hmmm decisions decisions;wallstreetbets;2021-03-17 08:38:42
gr7ubto;theredviper17;1;I still have some NKLA and BB, both down 70% and 55% respectively, lololol. Thinking about dumping them and adding it to my GME position;wallstreetbets;2021-03-17 08:23:09
gr7tpoi;Kembawalker1;1;"BB&amp;T STIMMYS HAVE ENTERED THE CHAT";wallstreetbets;2021-03-17 08:12:25
gr7sz2d;Scottysewell;0;BB👀;wallstreetbets;2021-03-17 07:59:55
gr7rmij;Scottysewell;1;BB;wallstreetbets;2021-03-17 07:37:19
gr7r000;VibrationsOfDoom;1;"No, I believe that DD includes the good as well as the bad. The reason I mentioned Ford going to the android system... Still, I didn't read much that WAS bad. And their Return On Equity was one of the things that REALLY caught my eye.   


They're ""seemingly"" out of the phone business... Unless you're good at reading between the lines... I can understand why they want shareholder perception steered away from anything remotely resembling phones...  


Except phones can be networked through your car in dash stereo... Like mine is... People might forget that part, especially in states like mine where thousands of people rushed out to buy hands free equipment for their cars when state laws cracked down on driving while using cell phones... Don't think BB isn't going to ride in on the back end of this...";wallstreetbets;2021-03-17 07:26:59
gr7qq92;VibrationsOfDoom;1;"Yes, I now admit there was some stuff that I left out. I actually just learned about the deal with Amazon tonight, ironically... That's what I mean about BB; there's been SO much stuff about them in the news lately... As if there weren't probably 100 more reasons to like BB... 

Well, maybe 37,910... :) The other 90 reasons went to Huaweii...";wallstreetbets;2021-03-17 07:22:35
gr7qmyq;Techno__Violet;1;"But the shorts are not significant for any special reason. The huge financial firms shorting AMC are doing it because a room full of professionals decided it was a profitable play. 

GME is special due the sheer magnitude of how much of it is shorted, and the questionable reporting with institutional investors reporting 115% of total shares ever issued, among other factors that are beyond my understanding. 

My hypothesis is that BB, NOK, and partially AMC came into play because they were all heavily shorted, and much more affordable than GME at the ""tipping point"" when GME first exploded and there was an influx of millions of users/traders buying in late game, and to the novice trader - buying 100 shares of a $4 stock is more psychologically satisfying than buying two shares of a $200 stock. 

The human dimension drives this whole train, not reason or logic. GME is the only legitimate player here (squueze business) and it is not guaranteed to do anything. 

The other stocks having long term legitimacy is beyond the scope of this comment.";wallstreetbets;2021-03-17 07:21:05
gr7pswi;TrashedLinguistics;1;Wrong sub bb. These are the ramblings of mad men.;wallstreetbets;2021-03-17 07:07:52
gr7otxw;darksoulmakehappy;1;"I think they just correlate because the same distressed debt hedge funds short gamestop are short other almost bankrupt companies. This started I didn't see any DD posted about BB NOK etc, but they all became overnight memes.

When the correlations stop, that might be the signal shorts covered.";wallstreetbets;2021-03-17 06:53:03
gr7oiri;l0wryda;1;it should be against wsb rules to post positions that are in rh. so many people in this community were affected by that bullshit they pulled that i downvote every post i see that’s a rh screenshot without even reading the content. i owned amc, bbby, bb, nok, and gme at the time and lost over 60k the day trading stopped. fuck robinhood.;wallstreetbets;2021-03-17 06:48:26
gr7oamb;ExcellentInflation0;1;"ET, spce puts, bb calls, slm calls long dated, 

Vixxxxxxxxxxxx";wallstreetbets;2021-03-17 06:45:00
gr7njh2;tmaxhhansen;1;NOK and BB always;wallstreetbets;2021-03-17 06:33:48
gr7je2o;Scottysewell;1;BB;wallstreetbets;2021-03-17 05:34:18
gr7ip8u;Kennywise91;0;86% rest AMC and BB;wallstreetbets;2021-03-17 05:24:59
gr7i7io;hockeyfan1990;7;"Aite I’m leaving the stock market and coming back to it once BB hits $100 and I’m filthy rich. 

Hopefully it’s not more than the next two weeks";wallstreetbets;2021-03-17 05:18:27
gr7hy3x;hockeyfan1990;1;"Aite I’m leaving the stock market and coming back to it once BB hits $100 and I’m filthy rich. 

Hopefully it’s not more than the next two weeks";wallstreetbets;2021-03-17 05:15:03
gr7gyl5;PrestigiousCourse579;1;I hope things go up for BB. You still have a good amount of time for that to happen. Hang in there.;wallstreetbets;2021-03-17 05:02:36
gr7gkqa;IAMTHECAVALRY89;1;I remember I applied to work at BB, and they wanted us to do free projects for them as part our application, I instead went to get a far better job.;StockMarket;2021-03-17 04:57:52
gr7fjm4;DerBasterd;8;BB keeps stalling on the way up and it comes back down. Lift off into space at least💎👐;wallstreetbets;2021-03-17 04:45:33
gr7f43f;DerBasterd;-16;Come on BB. It wants to take off, but it just stalls on the way up. 💎👐;wallstreetbets;2021-03-17 04:40:33
gr7eupv;FullCopy;1;What’s special about BB again?;wallstreetbets;2021-03-17 04:37:40
gr7eas8;Houston_swimmer;2;"Not quite at lambo status bb. Besides I live in Houston and when we say we’re the “Space City” we really mean driving on our potholed roads is like driving on the Lunar surface.

I’d bust an axle like first day in a lambo lol";wallstreetbets;2021-03-17 04:31:20
gr7e9yu;bafangoolNJ;1;I'm long in $BB, but holy shit, when I bought 330ish@16.84 back in January and immediately made a $2500 gain within hours, I thought I was set, G2G, but then HF's and RH, and TD fucked that party up.;wallstreetbets;2021-03-17 04:31:04
gr7e4c0;ssjgoat;3;Sorry didnt mean to facepalm, I just saw a cat and gave it to you bb;wallstreetbets;2021-03-17 04:29:18
gr7e1xn;oarabbus;10;lol BB does not rally on good news bro;wallstreetbets;2021-03-17 04:28:31
gr7dswk;HachibiJin;4;"""BB was issued a patent Tuesday for “methods and systems for autonomous vehicle refueling.” ""  


Tendies inbound??";wallstreetbets;2021-03-17 04:25:40
gr7cutt;ProvenCrownBuilders;2;God please let me.out ..holding at $17.50 coming down from meme Hype fomo..BB is a great company but I share the sentiment of the fellows here..;stocks;2021-03-17 04:15:09
gr7csdb;Drunkn_Cricket;3;"What about 98% down? 

Cries in 2022 BB calls";wallstreetbets;2021-03-17 04:14:24
gr7cpbr;frez1001;1;Hey bots spot me some gold... amc anus gme cnk bb 🪙🪙🪙;wallstreetbets;2021-03-17 04:13:30
gr7c4db;sheepbrother;0;Haha thanks. BB is still on top 10 mentions on daily, weekly, and monthly basis. Just not a very interesting data since it is popular already.;stocks;2021-03-17 04:07:11
gr7a5m2;Boomtown626;3;"Wall of text? check. 

Mentions NIO? check. 

Mentions TLRY, APHA, PLTR, NOK? Are you kidding me right now? Fucking CHECK, son!

Missing BB tho. 

Overall: 9/10. Very nicely done.";stocks;2021-03-17 03:46:28
gr79qno;VeryUnscientific;1;I'd invest in companies like LAZR or BB;investing;2021-03-17 03:42:11
gr78dkv;EFICIUHS;1;I'm long bb but I'm selling a bit now to free up cash to buy other stocks as I'm expecting it to go sideways for a while. A lot of the cool stuff won't becoming for a while;stocks;2021-03-17 03:28:21
gr7794u;itisbarbedwire;1;"I got a £20k loan in the weekend and invested it all. RKT, BB, NOK, RIDE. 

All Red lol";wallstreetbets;2021-03-17 03:17:14
gr76x6t;JayRymer;30;What about rkt or PLTR or uwmc or Tsla or sndl or unfi or bb?;wallstreetbets;2021-03-17 03:14:00
gr76h03;Thorrist;3;Probably not BB. My bags are heavy;wallstreetbets;2021-03-17 03:09:39
gr76g1y;jamez470;14;Damn I’d listen to you bb;wallstreetbets;2021-03-17 03:09:23
gr76g1m;Theaudacity0fit;1;I’ve been holding bb a good few months now and I’ve watched it slowly come back. I’ve said it before and I’ll say it again: I like the cut of their jib. I shall hold my shares for the long term;wallstreetbets;2021-03-17 03:09:23
gr76cax;sperrjo;13;All my BB homies where you at how we feeling what is uppppp;wallstreetbets;2021-03-17 03:08:22
gr76ajs;Neverdeadspiderweb;2;I heard you like vampires bb 🥵👅🦇💨🧛;wallstreetbets;2021-03-17 03:07:54
gr75wvd;_pureguava;2;"chu buying tomorrow?
think I may play it *relatively*safe and buy mainly AAPL/MSFT

or for a little risk, perhaps ARKF, ARKG, BB, BTC and some shroom stocks";stocks;2021-03-17 03:04:15
gr73uc4;eddyjqt5;1;I was going to buy extra shares of BB but I saved some cash just in case they dipped after earnings to average down;stocks;2021-03-17 02:44:27
gr73ifv;lordofhunger1;1;"I didn't save it unfortunately. 
Also, TD is still restricting selling options on ""hard to borrow stocks"" as far as I know. I had to sit on the phone for an hour last time I sold BB covered calls. Don't think they would allow me to even sell naked.";wallstreetbets;2021-03-17 02:41:20
gr713zk;DrunkenGolfer;3;Lol, both my current GME and BB are house money from my first go at GME.  I am usually an index fund investor.;StockMarket;2021-03-17 02:19:13
gr70mek;p3dal;0;But what about BB?;wallstreetbets;2021-03-17 02:14:49
gr70cux;skipx603;-2;BB;wallstreetbets;2021-03-17 02:12:28
gr703ho;ryn_pen;1;What would you like me to make you for dinner bb;wallstreetbets;2021-03-17 02:10:10
gr6zjlf;OnlineDesigned;1;"💕💕💕

Thanks BB. Make it a 🚀. Oh shit wait";wallstreetbets;2021-03-17 02:05:14
gr6z2c2;Wholistic;1;"Join Robinhood with a $1400 deposit and get the meme basket. A GME, AMC, BB, NOK, PLTR, SNDL, RKT.

That would actually work.";wallstreetbets;2021-03-17 02:00:58
gr6ynrp;jeepsaintchaos;1;"I suspect the phone thing really keeps them down. Everyone assumes it's like Blockbuster and they're taking their last, stuttering breaths before they bleed out since they left the phone market. Before joining this sub, I had forgotten BB existed, let alone that they might be doing anything worthwhile. 

BB needs to announce a return to making phones and then the stock will finally go up.";wallstreetbets;2021-03-17 01:57:24
gr6yjx6;jeepsaintchaos;3;"I suspect the phone thing really keeps them down. Everyone assumes it's like Blockbuster and they're taking their last, stuttering breaths before they bleed out since they left the phone market. 

BB needs to announce a return to making phones and then the stock will finally go up.";wallstreetbets;2021-03-17 01:56:27
gr6v3e1;Tank_Man_Jones;2;Time to buy BB puts!!;wallstreetbets;2021-03-17 01:25:39
gr6v12u;damn_nation_inc;6;"I got just a little of both, hoping both moon like mad. Honestly, I'm in on a bunch of those ""meme"" stocks that are actually all decent investments imo (NOK and BB are my other two). If any of these skyrocket ($1k+ on any), even with my miniscule holdings I'll see an amount of money in my hands at once that I've literally never ever had before, which is sad to say because it's maybe 50k or so.

FYI I am not shilling for GME to sell at 1k. That boy got wings, am holding all 3 of my shares until 100k or 0. But the others, I honestly would sell at least a few at 1k and handle some debts.

Edit: not advice. I just like the stonks.";wallstreetbets;2021-03-17 01:25:04
gr6ssn8;Guy0naBUFFA10;1;BB only makes crappy keyboard cell phones for financial boomers. Duh.;wallstreetbets;2021-03-17 01:05:11
gr6sqht;Poodogmillionaire;1;Long on BB, 300 shares now. Been buying the dip for weeks this week was a sight for sore eyes lol.;wallstreetbets;2021-03-17 01:04:39
gr6salj;ImAMaaanlet;1;"BONDS R FAKE AND 🌈

But i have boomer positions too.

steel gang and financials bb 😎";wallstreetbets;2021-03-17 01:00:44
gr6s9a0;puu222;6;"Look at the OP post history. he spams this shit over and over for karma and awards. a 1 month old account too.

He cant read a Bberg terminal and doesnt understand that in a situation like ours, the terminal doesnt even fucking help out because the data is old.

Hes just praying on retards who thing a BB terminal is a free pass to millions of tendies.";wallstreetbets;2021-03-17 01:00:25
gr6s7ec;UncleZiggy;2;My wild guess is that earnings will be at 240M w/o FB settlement and 290M (if they're playing quarterly as a subscription-based licensing fee) with the FB settlement, all the way as high as 450M depending on the payout. I think either way, BB is heading to the 15-30 range before the end of the year;stocks;2021-03-17 00:59:58
gr6s1g3;CalendarSufficient43;1;With BB, this is the way.;StockMarket;2021-03-17 00:58:32
gr6q2oa;insidiousFox;2;"&gt; I met a BB recruiter in 2016 at a job fair that gave me the best free pen I've ever received ...

This is hilarious haha, you've got to give more details on this pen!";wallstreetbets;2021-03-17 00:41:20
gr6pcui;LightBlindsAtFirst;2;"Legends say when the first meme-war took place BB became cursed. The curse started when computer algorithms that big money institutions use incorrectly correlated BB with other meme stocks due to unfortunate timing. Blind to the money they could be making, big money turned their backs on BB. 

The curse, once lifted, will transform BB into a beautiful woman, ready for the taking.";wallstreetbets;2021-03-17 00:35:07
gr6ota1;ThomasBagshaw;4;I plan to watch BB decrease in value consider even more good DD emerged.;wallstreetbets;2021-03-17 00:30:18
gr6ngjc;Forumites000;1;"Wsb was and is all about making money, don't explain yourself. You made it out here alive with profit, which is more than what most of us can say lmao. Good job, and fuck you.

The casino will always be opened if you're coming back again.

1 bb 17c jan21
1 nok 5c jan21
1 gpro 10c jan21 sold";wallstreetbets;2021-03-17 00:18:23
gr6ljt8;thewilltobehave;17;"Lmao I bought $260 of BB instead of GME like a month and a half ago 

Ha ha ha ha aha ahahahwhduwj 🤡";wallstreetbets;2021-03-17 00:01:35
gr6j2mj;pickbot;7;"**I am a bot and identified and tracked the following options picks within this post:**

|**Ticker**|**Strike**|**Type**|**Exp**|**Recorded Premium**|**Recorded Stock Price**|**OI**|**Volume**|
|:-|:-|:-|:-|:-|:-|:-|:-|
|**GM**|**$59**|**BUY PUT**|**2021-04-09**|**$3.47**|**$57.12**|**4**|**0**
|**BB**|**$12**|**BUY CALL**|**2021-04-30**|**$1.72**|**$11.46**|**128**|**92**
|**XOM**|**$62.5**|**BUY CALL**|**2021-07-16**|**$3.1**|**$59.11**|**1151**|**31**
|**KMI**|**$20**|**BUY CALL**|**2022-01-21**|**$0.51**|**$15.92**|**14496**|**133**

[Realtime ROI](https://www.pickmojo.com/pick/ckmcnrilyc7sx0751t2imbqba) | [Track Record](https://www.pickmojo.com/user/3dprintsAnomus/) | [Bot Info](https://www.reddit.com/r/pickmojo/comments/he9ghu/options_picks_tracking_bot_information/) | Leaderboard: [Week](https://www.pickmojo.com/stocks/best-this-week-reddit), [Month](https://www.pickmojo.com/stocks/best-this-month-reddit), [All](https://www.pickmojo.com/stocks/top-reddit) | [Exit this position](https://www.pickmojo.com/reddit_redirect)

**^(*Recorded after market close, will be recorded at the next market open if the premium is within 10% margin. My owner is monitoring these posts, reply with feedback! You can now track comments by mentioning me!)**";wallstreetbets;2021-03-16 23:40:02
gr6j06a;Im_Old_In_Town;-1;Sell my ICLN at a loss (1500 shares @ $27) buy BB shares this week? Hmmm;wallstreetbets;2021-03-16 23:39:26
gr6inhu;greatnate1250;1;I own Walmart as one of my  3 individual stocks and is also the only one that is negative since I purchased (Ford and BB). Having said that, WMT will be in my portfolio long after those other two are sold off. It's as safe as a savings account, grows every year and pays a good, safe dividend.;investing;2021-03-16 23:36:21
gr6i1od;IFlipChickens;3;Do we consider BB a meme stock? I honestly believe the company is making solid direction with the contracts they’re acquiring. I don’t really see another insane pop happening again but a slow climb over the year;stocks;2021-03-16 23:31:05
gr6gyd5;tryhardfit;2;Hey now, dont make fun of me selling BB puts.;wallstreetbets;2021-03-16 23:21:36
gr6gnu0;zghorner;1;BB only go down. Market up...BB down. Market down BB down...market flat...still...BB go down. Fuck my Sept Calls BB only go down.;StockMarket;2021-03-16 23:19:05
gr6gj0x;miamimed305;1;Start buying some calls, I bought some last week and recouped all my loses from buying BB stock at average price of 18.31;wallstreetbets;2021-03-16 23:17:58
gr6f18a;haijink;7;BB. I’m just furious that it got entangled in the meme stocks when that all first started;wallstreetbets;2021-03-16 23:05:17
gr6dvd4;Olthar6;1;Yeah. But their last offering was bb anyway so this was an upgrade;wallstreetbets;2021-03-16 22:55:37
gr6dock;Parliament--;1;If someone has a gd rbg keyboard and a legit BB terminal u bettter fucking believe im buying;wallstreetbets;2021-03-16 22:53:59
