id;author;score;body;subreddit;created_utc
gqpi7jq;wordsmithfantasist;3;Playing ‘Not Letting Go’ by Tinie Tempah as I hold onto BB and GME 🚀🚀🚀;wallstreetbets;2021-03-12 17:03:50
gqphwyd;canuckis;1;Hahaha! Get BB to the iron lung!;wallstreetbets;2021-03-12 17:01:39
gqphw4c;Mason-Derulo;5;BB has broken out of its downward trend. Regardless of if it skyrockets more today or not it’s a good buy;wallstreetbets;2021-03-12 17:01:28
gqphrpv;IllegalMammalian;3;Y’all really out here making my BB 3/12 @12 not the dumbest thing I’ve ever done wtf;wallstreetbets;2021-03-12 17:00:35
gqphr9v;Boryuha;1;Stimmy money will flood BB PLTR GME Monday. 💯;wallstreetbets;2021-03-12 17:00:29
gqphpl5;growfessor;19;Get on BB space rocket;wallstreetbets;2021-03-12 17:00:09
gqphnr9;What-Stock;8;"$AMC⬆️

$T⬆️

$NOK⬆️

$SU⬆️

$OCGN⬆️

$WEN⬆️

$GME⬆️

$BB⬆️

All of this ⬆️ makes this 🦍🍆 hard";wallstreetbets;2021-03-12 16:59:48
gqphkk4;cloudyoutside;1;Been holding BB, NOK, and GME since December before it was cool 😎;wallstreetbets;2021-03-12 16:59:09
gqphiu5;schuyywalker;15;"Bought BB at the top because of FOMO.

Need another push for that, SNDL &amp; AMC to make me feel better about myself going in to the weekend";wallstreetbets;2021-03-12 16:58:47
gqphit6;SPQUSA1;1;BB keeping me from total meltdown today. May be time to drop my ARKs, lol.;stocks;2021-03-12 16:58:46
gqphfwn;Jmarshall92;24;Where my BB holders at!?;wallstreetbets;2021-03-12 16:58:11
gqpha4p;OneStepTwoTrips;2;Finally got rid of my BB call options from forever ago. (Forever = 2.5 weeks);wallstreetbets;2021-03-12 16:57:02
gqpha3u;wordsmithfantasist;5;BB is rising and finally making money - how is that boring?;wallstreetbets;2021-03-12 16:57:01
gqph8fp;Dad_Bot;15;BB HOLDERS WERE GONNA PARTY LIKE ITS SPRING 2008;wallstreetbets;2021-03-12 16:56:40
gqph7a9;Rektifyre;5;"Alright boys and girls.  BB's time has cum!  BB just is in the middle of a gamma squeeze as we speak heading into the heaviest call option season in BB history.  $28 was a proof of concept.  We are about to take this stock to the next level.  Quad Witching will MOON this beast.  


All smack talking aside, we just broke $11 on 3/12.  13,000 call contracts just went into the money and the gamma on these bad boys is like 0.98.  Next week, we have boosters from $11 to $15 to $20 to $25.  The squeeze will squooze in a ridiculous way.  


This is not financial advice.  I'm not a cat.  Postition 1,200 @ avg $14.30 plus some LEAPS.";wallstreetbets;2021-03-12 16:56:26
gqph6xy;cptphoto;18;BB doin it’s thang;wallstreetbets;2021-03-12 16:56:22
gqph5xw;Mountain_Succotash_5;1;Been a bitch seeing bb run to 28 and I held. Not too worried though since the fundamentals actually exist for bb;wallstreetbets;2021-03-12 16:56:09
gqpgxdl;DingoProfessional635;4;Keep BB out of here. It’s doing just fine under the radar and will get regrouped by wsb retards and drop into oblivion.;wallstreetbets;2021-03-12 16:54:23
gqpgx2p;dhatkid15;3;I know I’m losing less money on bb I hope this isn’t a dream.;wallstreetbets;2021-03-12 16:54:20
gqpgwjk;Pitiful-Awareness-19;2;I think the chance that GME goes way up is better than waiting on BB. Should cancel out my losses. Fingers crossed;wallstreetbets;2021-03-12 16:54:13
gqpgwa7;ryanryans425;1;Bb is up higher now dumbass;wallstreetbets;2021-03-12 16:54:10
gqpgw7w;LaReGuy;1;Welcome to the club! I liquidated my $NOK and $BB when $GME was around $110. Thought about it for 2 seconds, then pulled the trigger. Easy decision at the time.;wallstreetbets;2021-03-12 16:54:09
gqpgvkt;ITried2;1;BB doing well;stocks;2021-03-12 16:54:02
gqpgvbc;imtotallybananas;4;Yeah..bb gang;wallstreetbets;2021-03-12 16:53:59
gqpgtrm;Takoyak1;10;Can't Spell Brrr Brrr without BB 🚀🚀🚀;wallstreetbets;2021-03-12 16:53:39
gqpgtet;Live_Painter_9573;7;Holy shit I’m actually making money on BB? What timeline is this?;wallstreetbets;2021-03-12 16:53:35
gqpgq62;Pitiful-Awareness-19;45;Fuck it I’m selling my BB for a loss and buying another GME. Here’s to hoping it’s a good move. 🍻;wallstreetbets;2021-03-12 16:52:56
gqpgoyk;michty6ty6;14;"Weekend BANG price targets, let's fucking rip:

$BB $15

$AMC $15

$NOK $7

$GME $350";wallstreetbets;2021-03-12 16:52:41
gqpgnuh;bsr92;10;BB TAKE OFF LETS GOOOOOOO;wallstreetbets;2021-03-12 16:52:28
gqpgmw5;dhatkid15;7;Bb keep printing;wallstreetbets;2021-03-12 16:52:16
gqpgmrk;wordsmithfantasist;5;BUYING BB AT THIS BARGAIN PRICE;wallstreetbets;2021-03-12 16:52:14
gqpglys;SwagglesMcNutterFuk;6;BB and BBBY booming;wallstreetbets;2021-03-12 16:52:04
gqpglux;bosshax;7;$BB MAKING MOVES!!!!;wallstreetbets;2021-03-12 16:52:03
gqpgl2j;JayPowelOptionCalls;7;Alright guys, I just fomoed back into BB and GOEV lol;wallstreetbets;2021-03-12 16:51:53
gqpgkfn;Opisdan-;10;Bb about to gamma at 11.6 get in the rolctet;wallstreetbets;2021-03-12 16:51:46
gqpgjgs;Mountain_Succotash_5;16;Bb on moon mission finally been holding these heavy ass bags for a while 2k shares average 15;wallstreetbets;2021-03-12 16:51:33
gqpgi2j;wordsmithfantasist;4;end of day predictions for BB??;wallstreetbets;2021-03-12 16:51:16
gqpghq1;hewijnabob;14;BB to the moon!;wallstreetbets;2021-03-12 16:51:12
gqpgfrn;wordsmithfantasist;12;WE’RE SAVING BB 🚀🚀🚀;wallstreetbets;2021-03-12 16:50:48
gqpgfk3;cpacfaduo;10;CMON BB!!!! 🚀🚀🚀🚀🚀;wallstreetbets;2021-03-12 16:50:45
gqpgfcq;TonyTrismegistus;14;BB going to hit 13 today;wallstreetbets;2021-03-12 16:50:43
gqpgf0m;travellinglaowai;13;"$BB wtf.  
Why are you mooning TODAY of all fucking days?";wallstreetbets;2021-03-12 16:50:39
gqpgeiv;growfessor;15;BB $15 EOD;wallstreetbets;2021-03-12 16:50:33
gqpgdln;wordsmithfantasist;10;The cool kids are buying BB 😎;wallstreetbets;2021-03-12 16:50:21
gqpgdfc;42252252;2;"I'm holding a good chunk of stock in BB, but it really seems like a lot of the posting about it is coming from the $BB sandbox while we look over at the GME and AMC kids having fun in theirs.   Ever since we got the meme stink on it it's been even more boring than before. 

I still think it's going to go around $30, but not in an instant, and I really doubt it'll happen before the whole GME story arc is completed.  A lot of the boosts so far were just riding the wave of retail enthusiasm, and none of the news so far really points to imminent FOMO activity.";wallstreetbets;2021-03-12 16:50:19
gqpgcy1;BlackStar4;1;Thanks, I just sold my BB shares, now I can buy more GME!;wallstreetbets;2021-03-12 16:50:13
gqpgcpl;Mason-Derulo;15;Wow the dip on BB got bought the fuck up;wallstreetbets;2021-03-12 16:50:10
gqpg93r;Ballsmeetpets;9;Holy shit BB;wallstreetbets;2021-03-12 16:49:26
gqpg8gm;michty6ty6;8;$BB time to go to the moon  🚀  🚀  🚀  🚀;wallstreetbets;2021-03-12 16:49:18
gqpg688;ctrinity2231;11;BB MOVING LIKE ITS 2005! 🚀🚀🚀🚀;wallstreetbets;2021-03-12 16:48:50
gqpg655;Dad_Bot;1;Huge BB guy but the volume isn’t that high right now haha;wallstreetbets;2021-03-12 16:48:49
gqpg2fx;Tradergurue;5;BB next leg up soon! HUGE buying volume;wallstreetbets;2021-03-12 16:48:04
gqpg1wg;cardiosc;6;Tsla Comon bb;wallstreetbets;2021-03-12 16:47:58
gqpg1e5;Im_Old_In_Town;2;Nope. BB will be huge in a year or two. New partnership with Amazon and Earning report at the end of the month. Just know it’s a long hold;wallstreetbets;2021-03-12 16:47:51
gqpg16e;wordsmithfantasist;3;BB moving because of the stimulus check?;wallstreetbets;2021-03-12 16:47:49
gqpg12n;YoBoySatan;9;Finally some BB movement!;wallstreetbets;2021-03-12 16:47:48
gqpfzrr;YoBoySatan;-1;Finally some movement on BB! GME, AMC, BB let’s goooooooooo;wallstreetbets;2021-03-12 16:47:31
gqpfz10;growthinvestor123;6;$BB gang represent! We're squares compared to GME gang but you will find we are a more steady eddy gang ofdiamond hands with true belief in fundamentals.;wallstreetbets;2021-03-12 16:47:22
gqpfx7t;wordsmithfantasist;5;BB 🚀🚀🚀;wallstreetbets;2021-03-12 16:47:00
gqpfx6r;lIlIlIlIlIlII;1;That retarded bznewswire article about BB and PLTR was the reason for the pump ..;wallstreetbets;2021-03-12 16:47:00
gqpfwqu;wordsmithfantasist;5;BB is the next BB!!;wallstreetbets;2021-03-12 16:46:54
gqpfvl9;Bandeth;9;BB IS NOT A MEME STOCK!;wallstreetbets;2021-03-12 16:46:40
gqpfuhq;FumbleHuck;3;This is the way. $BB Gang;wallstreetbets;2021-03-12 16:46:27
gqpftuz;DyIanLL;15;OH MY BB 🚀🚀;wallstreetbets;2021-03-12 16:46:19
gqpftmi;TajPereira;10;Let’s go Bb;wallstreetbets;2021-03-12 16:46:16
gqpftk6;TonyTrismegistus;10;bb;wallstreetbets;2021-03-12 16:46:15
gqpfs3d;Jbezer;12;BB 🚀🚀;wallstreetbets;2021-03-12 16:45:57
gqpfrnd;SugShayne;10;BB keep it UP!!!;wallstreetbets;2021-03-12 16:45:51
gqpfqpq;k_lirv;12;BB finally catching up!;wallstreetbets;2021-03-12 16:45:39
gqpfq8u;vincesuarez;-27;Holy shit BB gang! My wife’s boyfriend is so pleased with you!;wallstreetbets;2021-03-12 16:45:34
gqpfq3d;culomanos;6;wish i could’ve bought the BB dip fuck!;wallstreetbets;2021-03-12 16:45:31
gqpfplc;Im_Old_In_Town;1;BB is a long hold. Going to be huge in a year or two.;wallstreetbets;2021-03-12 16:45:25
gqpfp7c;leancup8;6;Let’s go ! quick 300$ from $BB keep extra chromosoming !!!!;wallstreetbets;2021-03-12 16:45:21
gqpfp76;farleymfmarley;3;is it too late to buy BB;wallstreetbets;2021-03-12 16:45:21
gqpfp2t;chiller_diller;5;BB with that GME shit wow;wallstreetbets;2021-03-12 16:45:19
gqpfp0y;wordsmithfantasist;8;LOVE BB!! BB GANG RISE UP!! 🚀🚀🚀;wallstreetbets;2021-03-12 16:45:18
gqpfp0c;SerpentSailer;10;BB finally fucking rocketing;wallstreetbets;2021-03-12 16:45:18
gqpfoub;cragfar;8;It's weird looking at BB and not being annoyed. Almost forgot what hope felt like.;wallstreetbets;2021-03-12 16:45:16
gqpfnwm;ryanryans425;-178;Everyone sell gme to get bb!! It’s taking off!! 🚀🚀🚀;wallstreetbets;2021-03-12 16:45:04
gqpfnou;Batmanforreal2;9;BB mooningg;wallstreetbets;2021-03-12 16:45:02
gqpfnjb;SandwichMankind;10;Why is BB moving lmao;wallstreetbets;2021-03-12 16:45:00
gqpfng0;vegasnick2241;9;BB you coming back?;wallstreetbets;2021-03-12 16:44:59
gqpfncg;SilentRedBoi;7;oh yes BB baby, I like the way you are moving, keep it up;wallstreetbets;2021-03-12 16:44:58
gqpfmop;dontevenstartthat;12;BB FUCK YEAH;wallstreetbets;2021-03-12 16:44:49
gqpflxm;Dendoitt;6;"NOK &amp; BB 🚀";wallstreetbets;2021-03-12 16:44:40
gqpflc6;MaxRockafeller;5;Hey PLTR - see what BB is doing? Do that.;wallstreetbets;2021-03-12 16:44:33
gqpfiaz;tacofury-inc;18;Oh yah BB show me that green dick;wallstreetbets;2021-03-12 16:43:55
gqpfgk9;EastCoastProtoDad;14;Hope the bb rocket isn’t done because i just bought at the top;wallstreetbets;2021-03-12 16:43:34
gqpfg2h;Speedyx;12;bb jumping;wallstreetbets;2021-03-12 16:43:28
gqpff5f;digiballoon;12;BB making moves;wallstreetbets;2021-03-12 16:43:16
gqpfemu;dhatkid15;4;Which one of you beautiful cucks is buying bb;wallstreetbets;2021-03-12 16:43:10
gqpfdrs;wordsmithfantasist;7;I’m not just in BB because of the ‘meme’ (though that’s part of the reason). I’m not just in BB because I want to make money (though that’s another part of the reason). I’m in in BB because I have great memories of messaging my friends over BBM and loving that BlackBerry phone I had and the fact these hedge funds tried to short a company that was trying to turn itself around... makes my blood boil.;wallstreetbets;2021-03-12 16:43:00
gqpfd2m;Degen-King;2;Finally even on BB l, do I sell or hold??;wallstreetbets;2021-03-12 16:42:51
gqpfbqo;Mason-Derulo;9;Holy shit BB going vertical;wallstreetbets;2021-03-12 16:42:36
gqpfb8u;scanthethread2;8;BB is cruising today!;wallstreetbets;2021-03-12 16:42:30
gqpf96j;ctrinity2231;10;BB probably getting the best week in years;wallstreetbets;2021-03-12 16:42:04
gqpf8yb;ryanryans425;8;Holy fuck bb is taking off thank god I bought bb instead of amc 😂🚀🚀🚀;wallstreetbets;2021-03-12 16:42:02
gqpf8qv;br11112;9;F and BB 💉💉💉;wallstreetbets;2021-03-12 16:41:59
gqpf6y9;YooYooYoo_;16;Yes BB please come pick me up;wallstreetbets;2021-03-12 16:41:37
gqpf3hk;dumb-researcher;17;Go BB go!!! 🚀🚀🚀;wallstreetbets;2021-03-12 16:40:54
gqpf2hk;Im_Old_In_Town;11;BB third thruster of the day about to go off;wallstreetbets;2021-03-12 16:40:42
gqpf1op;Mason-Derulo;5;BB and CLF keeping me green today;wallstreetbets;2021-03-12 16:40:33
gqpf12x;Dynamic_Doug;6;BB and NOK running because of stimmy hype?;wallstreetbets;2021-03-12 16:40:25
gqpeyrc;Apex_Fail;8;BB and T saving me today just as expected 😂;wallstreetbets;2021-03-12 16:39:57
gqpewut;Thorx99;10;Proudly holding my 1800 shares of BB I got at 8.90 😎;wallstreetbets;2021-03-12 16:39:33
gqpeuzb;growfessor;10;BB to the mooooon 🚀📈📈🚀📈📈;wallstreetbets;2021-03-12 16:39:11
gqpeu5a;brhall1;3;I paper handed my BB calls this morning like a fucking bitch. 🤦;wallstreetbets;2021-03-12 16:39:01
gqpetzq;corndognugget;3;What specifically about next week could be huge for BB?;wallstreetbets;2021-03-12 16:38:59
gqpepg7;Cutie_Panther;16;BB 🚀🚀🚀🚀🚀🚀🚀🚀🚀;wallstreetbets;2021-03-12 16:38:03
gqpenxg;Top-Turn1055;-4;Better offload some of those BB bags.;wallstreetbets;2021-03-12 16:37:44
gqpelmo;Thats_arguable;2;"Also 100% here.

GME then BB stays the plan";wallstreetbets;2021-03-12 16:37:15
gqpeiwd;MisterMorgo;9;Is BB about to rip?;wallstreetbets;2021-03-12 16:36:43
gqpeg0g;sketch_toy;1;Insane lol. Made a cool 5k on nok that day and burned it in bb;wallstreetbets;2021-03-12 16:36:06
gqpedin;wordsmithfantasist;10;BB GANG 🚀🚀🚀;wallstreetbets;2021-03-12 16:35:35
gqpebtr;wordsmithfantasist;9;Time to buy more BB!!!;wallstreetbets;2021-03-12 16:35:15
gqpeaqz;Demogorgonaut;7;BB relief level: when you transition from bloody diarrhea to just very soft turds;wallstreetbets;2021-03-12 16:35:02
gqpeaqf;nilfgaardianleviosa;1;You think BB gon go up?;wallstreetbets;2021-03-12 16:35:02
gqpe79i;Space_Lord_MF;10;"BB up again. Still cheap to get in if you haven't already.

Next week could be huge.";wallstreetbets;2021-03-12 16:34:20
gqpe58r;haragaigembe;6;keep going bb you know you want to;wallstreetbets;2021-03-12 16:33:55
gqpdrpe;majorBotHead;10;Go BB go;wallstreetbets;2021-03-12 16:31:06
gqpdnsc;WizardT88;7;BB remembering stonks go up;wallstreetbets;2021-03-12 16:30:17
gqpdkpo;dhatkid15;8;Bb going up;wallstreetbets;2021-03-12 16:29:40
gqpd9ih;wordsmithfantasist;7;Am I going to buy more BB now that it’s reached over $11? Yes.;wallstreetbets;2021-03-12 16:27:23
gqpd578;canuckis;4;I feel like my child took their first steps- BB broke $11.;wallstreetbets;2021-03-12 16:26:30
gqpd0f6;Merc1AndrewSS;1;Apparently there is a lot of people that didn't do any research. The companies next steps are going to send it rocketing, at each turn. If it gets shorted, i think it will get put on the same level as GME, BB, and AMC.;stocks;2021-03-12 16:25:30
gqpcymg;sblct;4;Some of you optimists just met BB I take it?;wallstreetbets;2021-03-12 16:25:08
gqpcxxr;lucasjhinton;1;I literally just read a comment that said that lol not hating on BB;wallstreetbets;2021-03-12 16:25:00
gqpcx8c;vball14;10;BB finally over 11;wallstreetbets;2021-03-12 16:24:51
gqpcvnu;saildnas;4;No one is saying BB is the new GME??? BB is a just another good stock;wallstreetbets;2021-03-12 16:24:31
gqpcviv;Im_Old_In_Town;6;BB isn’t GME because BB has actual fundamentals and is going to be a huge company in the next year or two.;wallstreetbets;2021-03-12 16:24:29
gqpcqc8;TendieTownUSA;10;BB 🚀;wallstreetbets;2021-03-12 16:23:26
gqpcpa8;lucasjhinton;-1;🤦‍♂️ “Bb Is ThE nEw GmE” GME is doubling BB gains rn;wallstreetbets;2021-03-12 16:23:13
gqpcosq;dawg-in-law;7;1111 bb make a wish;wallstreetbets;2021-03-12 16:23:08
gqpchme;BrokeDayTrader;11;Damn BB you do you lettss gooo;wallstreetbets;2021-03-12 16:21:40
gqpcg76;Tradergurue;8;BB is just continuing up!?!;wallstreetbets;2021-03-12 16:21:22
gqpcadg;whenabouts;2;I appreciate the effort to influence near 1,000 000 WSB members to pump the stock. Side note: read yesterday that BB is in 61% of EV vehicles! You laugh now....;wallstreetbets;2021-03-12 16:20:10
gqpc90o;Wayeb;16;Whoaaa BB is that a roll of quarters in your pocket??;wallstreetbets;2021-03-12 16:19:53
gqpc8g6;Upset_Theme_2109;11;Who’s running NOK And BB?;wallstreetbets;2021-03-12 16:19:46
gqpc7r7;Wurzelgemuese;7;My portfolio is 60% BB 40% GME so all the GME gains were swallowed by BB being dogshit. Today BB finally shows what it's got. Go get em 🚀🚀🚀;wallstreetbets;2021-03-12 16:19:38
gqpc779;mijiwa;10;Why is BB going up? Bad news ?;wallstreetbets;2021-03-12 16:19:31
gqpc6qc;CoastingUphill;17;"Guess what the only green stocks today are:

$GME $AMC $NOK $BB";wallstreetbets;2021-03-12 16:19:26
gqpc3z4;AG42069;1;BB starting its primary thruster engines today on its mission to the moon!;stocks;2021-03-12 16:18:51
gqpc3op;Dendoitt;4;NOK and BB literally have the same trends;wallstreetbets;2021-03-12 16:18:47
gqpc2mk;Shivyk;1;Bro ur salty about bagholding BB, fuck off;wallstreetbets;2021-03-12 16:18:34
gqpc1lq;StonkmahnDouchenberg;1;BB now up 35 cents or 3.08%;wallstreetbets;2021-03-12 16:18:21
gqpc13k;Batmanforreal2;12;BB breakout;wallstreetbets;2021-03-12 16:18:15
gqpbydc;cobraleader;1;Well that seems kind of stupid.  WSB talked about BB and it went from $5 to $28. They talked about RKT and it went from $20 to $40. Do you not like money?;stocks;2021-03-12 16:17:41
gqpbwor;exiasprip;5;Is BB just a long play now?;wallstreetbets;2021-03-12 16:17:21
gqpbsjd;Tradergurue;11;BB +$11 🚀🚀🚀;wallstreetbets;2021-03-12 16:16:28
gqpbsc5;Im_Old_In_Town;4;Can’t stop this BB train;wallstreetbets;2021-03-12 16:16:26
gqpbqji;MisterMorgo;4;Those BB 0DTE are CRAZY cheap, even the ITM ones. Wild.;wallstreetbets;2021-03-12 16:16:04
gqpbq5d;BigDerbsBiggerStonks;0;BB is that you?;wallstreetbets;2021-03-12 16:15:59
gqpbmme;Brazda25;5;BB is mooning?;wallstreetbets;2021-03-12 16:15:16
gqpbmh2;Im_Old_In_Town;8;BB about to break through $11;wallstreetbets;2021-03-12 16:15:14
gqpblxe;Wayeb;9;I just want BB to be happy :);wallstreetbets;2021-03-12 16:15:07
gqpbl3d;Son_of_Sephiroth;14;"AMC &amp; BB headed back to the promised land";wallstreetbets;2021-03-12 16:14:57
gqpbj7e;HourlyTechnician;1;Still down 43% on BB. Glad it's only 5% of my portfolio.;wallstreetbets;2021-03-12 16:14:34
gqpbcl0;harrison_wintergreen;1;"partly, you just bought at the peak and things have cooled off. 

partly, you bought trendy/meme stocks like BB and AMC. don't chase trends. when everyone is buying X, you should be suspicious and looking for Y and Z. 

ditto your core position needs to be something covering a broad cross section of the US market. S&amp;P 500 index, Russell 1000 index, a total market index. this will be a lot safer. IMO people should't start with single stock until they have at least a few thousand in a broad market index. 

&gt;Watching YouTube sometimes

the majority of YouTubers are worthless on stocks and investing. absolute trash. IMO the only things worthwhile on YouTube are interviews with Buffet/Munger, Peter Lynch, Joel Tillinghast, Howard  Marks, Joel Greenblatt, etc. professional investors with decades of experience. 

go to your local library. read books on investing. I recommend the following: 

Benjamin Graham, The Intelligent Investor. Dated in parts, but the ""Mr Market"" chapter and ""margin of safety"" concepts are worth 10x their weight in gold.

Snowball: Warren Buffett and the Business of Life

Peter Lynch, One Up on Wall Street, and Beating the Street. In that order. Also a bit dated in some ways, but the basic advice and methods he teachers are bulletproof. 

Joel Greenblatt, The Little Book that Beats the Market

Christopher Browne, The Little Book of Value Investing.

Common Stocks and Uncommon Profits, by Phillip Fisher

His son Ken Fisher has written some good stuff, 100 Minds who Made the Market is a good historical overview of the history of Wall Street investing. The Little Book of Market Myths is free on his website: https://www.kenfisher.com/books/little-book-market-myths

Joel Tillinghast, Big Money Thinks Small

Joeron Bok, Deep Value";stocks;2021-03-12 16:13:11
gqpb10z;ryanryans425;6;BB gonna hit $20 before AMC you heard it here first;wallstreetbets;2021-03-12 16:10:47
gqpaznx;thatjitzguy;3;I only have one cheap call in BB so I don't care much whst it does. But if it hits $11 it's free and clear with almost no resistance for quite awhile.;wallstreetbets;2021-03-12 16:10:30
gqpayd9;chiller_diller;3;BB🥵;wallstreetbets;2021-03-12 16:10:15
gqpaup2;canuckis;5;Let’s go BB!;wallstreetbets;2021-03-12 16:09:29
gqpatve;sblct;3;the bb i have is up just 2 %;wallstreetbets;2021-03-12 16:09:19
gqpatdh;Cyberchaos;11;280 floor is nice but come on 300 bb;wallstreetbets;2021-03-12 16:09:13
gqpapgl;Tradergurue;4;⚠️BB break out⚠️;wallstreetbets;2021-03-12 16:08:23
gqpamfj;Im_Old_In_Town;7;BB second thruster engage;wallstreetbets;2021-03-12 16:07:45
gqpambb;dontevenstartthat;4;"Come on BB, I believe in you! 

Stick them 0dte calls into the money!";wallstreetbets;2021-03-12 16:07:43
gqpade8;Im_Old_In_Town;5;BB about to take off again;wallstreetbets;2021-03-12 16:05:55
gqp9jp6;Tradergurue;5;Almost all tech stocks is down. But BB is fucking green🏎🏎🏎;wallstreetbets;2021-03-12 15:59:49
gqp9ct7;throwawaylurker012;1;Ok bb;wallstreetbets;2021-03-12 15:58:24
gqp8xyf;Chachmaster3000;1;"This GME/AMC/BB nonsense is neckbeard heaven

LEAVE NECKBEARD ALONE SHE NEVER DONE ANYTHING TO YOu!";wallstreetbets;2021-03-12 15:55:21
gqp8ddz;StonkmahnDouchenberg;7;"$BB is UP 20% since last Friday's low. It's broken out of a multi-month downtrend. It's breaking through it's 20-Day Moving Average. The Nasdaq 100 is down 1.74% and BB is UP 1.00% and climbing.   
[https://new.reddit.com/r/wallstreetbets/comments/m3jpcy/bb\_blackberry\_has\_broken\_out\_and\_is\_mooning/](https://new.reddit.com/r/wallstreetbets/comments/m3jpcy/bb_blackberry_has_broken_out_and_is_mooning/)";wallstreetbets;2021-03-12 15:51:06
gqp8b46;Viscoden;1;"The best early piece of information I gained was to think about buying a company in terms of using your own money to purchase the entire company.

It's easy to see a numbers on a screen and say ""it went up before, so I think it will again"".

It's hard to say ""no, I would not spend 600, 700 billion of my own money to purchase Tesla, because the company doesn't make enough money for me to justify that purchase"" when you see how well it has returned for shareholders in the last year. 

Investing is about risk management and facts. 

BB is currently valued at 6.29 billion, with an income of -830m (trailing twelve months). To put that in perspective, if you spent 6.3 billion dollars to buy all public shares of BB, you could then expect to lose an additional 830 million over the next 12 months. Now this is a flawed example because it is known that BB is turning around their business in a very attractive way, but it may take some time for that to catch up to make the business positive income. 

Now I do want to say that I do own a little bit of BB, but it's money that I can afford to let sit for a little while, and it's around half a percent of my active portfolio. I like the possibility of BB turning around the company and becoming a huge tech company once again.

I'd say that from my perspective it seems like you are at a point where you need to start laying the foundation for a solid portfolio. I'd recommend things like MSFT, AAPL, JPM, EBAY. I try to pay attention to P/E ratios and to buy when I think a company is at a good value. All of these companies make a TON of money, and I'd be impressed if any one of them failed within the next ten years. 

I'd caution you to reevaluate ""get rich quick"" buys, as they will statistically not work out well for you. Better to take 20% every year and turn that in to a compounding machine than to take 100% one month and lose it all over the next year. 

You won't turn your $500 back in to $2,000 in a few days, but you could retire in the future using this method. Try out the math for making a 20 or 30% annual return over 10 years. Start with something like 10k and watch what happens. And that's not even including what you could add to it over that time as well.

I'm not a financial advisor, always do your own research and come to your own conclusion. Remember that your money is on the line. I wrote this at 2 in the morning so please forgive any mistakes I may have made.";stocks;2021-03-12 15:50:37
gqp83hn;StonkmahnDouchenberg;1;$BB is UP 20% since last Friday's low. It's broken out of a multi-month downtrend. It's breaking through it's 20-Day Moving Average. The Nasdaq 100 is down 1.74% and BB is UP 1.00% and climbing.;wallstreetbets;2021-03-12 15:49:01
gqp7z6o;scbtl;2;"NOK is basically a play that Joey B will drive 5G infrastructure projects and leverage NOK/Ericksson instead of Huawei. They have a massive float and are conceivably undervalued but I wouldn't be surprised if the push, depending on the timing switches from trailing in 5G to trying to get ahead with 6 or 7G. He could also flip on China and embrace them and then NOK is left out in the cold.

BB is a better play, but a lot of it's value has already been sucked up. It should appreciate but probably slowly.";wallstreetbets;2021-03-12 15:48:07
gqp7vdh;Pipepoi;6;"$BB🚀

 [$BB 🍇 : wallstreetbets (reddit.com)](https://www.reddit.com/r/wallstreetbets/comments/lz61vn/bb/)";wallstreetbets;2021-03-12 15:47:21
gqp7eeb;Im_Old_In_Town;2;Not sure about NOK. But BB is partnered with Amazon for their IVY autonomous driving capability and BB is huge in the security sector. I think they will be huge in the next year or two.;wallstreetbets;2021-03-12 15:43:49
gqp79g4;worsethanwetsocks;11;Run up the fucking gamma ramp bb 🥵🥵🥵🥵🥵;wallstreetbets;2021-03-12 15:42:47
