id;author;score;body;subreddit;created_utc
gqghbdh;Pat_riot88;6;BB was not a meme stock.  Just got wrapped up in the hype.  It is undervalued.  More of a long play.;wallstreetbets;2021-03-10 15:57:38
gqgh8tg;leancup8;8;Why can’t BB just retard just once and have a 3-4$ gain man .... PLS tendie man ...;wallstreetbets;2021-03-10 15:57:13
gqgh6wr;leancup8;19;BB makes me so sad every single day man .;wallstreetbets;2021-03-10 15:56:53
gqgh4rq;karmacum;2;Can we just admit the BB is no longer a meme stock? More like meme stuck;wallstreetbets;2021-03-10 15:56:28
gqggzwa;Prize_Willingness118;3;"BB is absolutely undervalued. BB has so many irons in the fire, they may as well have built the whole fucking forge. BB is the future of universal security. I'm just an 🦍 but me likey what I see. You can find more DD than DDay browsing the reddits. Were going to the moon boys and girls. 

I LOVE this stonk 🦍🚀🚀🚀🚀🦍";wallstreetbets;2021-03-10 15:55:28
gqggxp5;Kemilio;8;Fuck you BB;wallstreetbets;2021-03-10 15:55:02
gqggsae;chef47;4;Still holding BB... and waiting...and waiting...and waiting...;wallstreetbets;2021-03-10 15:53:57
gqggrm8;OneStepTwoTrips;9;BB, why you gotta tease me like that?;wallstreetbets;2021-03-10 15:53:49
gqggpwo;smittysmittson;5;Once bb shows a revenue plan for qnx that stock is going to make anyone holding it a ton of money;wallstreetbets;2021-03-10 15:53:35
gqggh0z;Ok_Fill5711;5;Bb is just singing skylar grey’s “I will return” to himself;wallstreetbets;2021-03-10 15:51:59
gqgg6rs;Prize_Willingness118;1;BB MOON SEQUENCE LAUNCH IN 5..4...3...2.....1. 🚀🚀🚀🚀🚀🦍;wallstreetbets;2021-03-10 15:50:05
gqgg5td;aaron99999999999;2;BB$50;wallstreetbets;2021-03-10 15:49:53
gqgg0hp;PlatypusOfWallStreet;3;"Believe it or not. Lots of folks don't know this but blackberry is an excellent cybersecurity company.

Everyone is raving about their cars but its overshadowing the fact that bb survived post phones with their security solutions.

Anyone using bb was not affected by the SolarWinds breach.";investing;2021-03-10 15:48:50
gqgfyxc;Tradergurue;7;Come on $BB;wallstreetbets;2021-03-10 15:48:31
gqgfsue;claite296;2;Wow bb dead;wallstreetbets;2021-03-10 15:47:28
gqgfqd4;vincesuarez;6;Where the BB peeps at;wallstreetbets;2021-03-10 15:46:58
gqgflc9;yeetasaurus-recks;1;"I have the ticker up on my second monitor in class lol.. and honestly if GME pans out I might just sell my BB and AMC at a small loss for the tax benefits then put the excess money back into my ""boring not ape-man portfolio"". Thanks for the pep talk you beautiful retard";wallstreetbets;2021-03-10 15:45:57
gqgffum;Ballsmeetpets;3;Bb was up 5% now it’s down.. dunno what I expected;wallstreetbets;2021-03-10 15:44:50
gqgfejp;SpandyBarndex;1;Bb MVIS;wallstreetbets;2021-03-10 15:44:34
gqgf8mm;Kemilio;4;Holy fuck those BB calls were some of the worst calls I’ve made in a while;wallstreetbets;2021-03-10 15:43:23
gqge2qs;jostradumass;13;LOL this short attack is cute. It’s like bringing a BB gun to Afghanistan.;wallstreetbets;2021-03-10 15:34:55
gqgd2e2;Ap3X_GunT3R;1;"Personally, I wouldn't bet on a cybersecurity ETF unless you plan on holding for the long term. They will be able to offer you quality averaged gains which is very nice and takes the legwork out from researching stocks. The issue is you're paying an expense ratio of .5%-.6% to beat VTI or VOO at .03%. Many of these cybersecurity companies are most likely holdings within VTI and VOO to an extent. 

As another comment notes, this sector is constantly being disrupted and competition is FIERCE. Companies can see their products swapped out for any number of reasons. Innovation is key and it's very hard to figure out who might bring the next game changing product. 

I recommend doing the research and taking a direct position in plays. 

Disc: I hold CRWD and BB. I am not a financial advisor, just a guy on the internet.";investing;2021-03-10 15:27:21
gqgcz2n;mikael-mikkelsen;11;GME and a little on AMC and BB fm;wallstreetbets;2021-03-10 15:26:41
gqgcthk;porkmoney;2;I'm riding the same call after selling BB. LET'S RIDE;wallstreetbets;2021-03-10 15:25:32
gqgcry0;El_Pollo_Loco_503;2;Hang on and strap on bb!;wallstreetbets;2021-03-10 15:25:12
gqgcmhn;BeepBeepBurntLettuce;6;Sold my BB for RBLX;wallstreetbets;2021-03-10 15:24:05
gqgcg1d;ultimatehose89;4;BB is due a spike since all the memes are going up! Let’s gooooo;wallstreetbets;2021-03-10 15:22:46
gqgcaq2;ManaSpoon;16;"I see trees of green... GME rockets too... I see BB bloom, for me and you.  
And I said to myself... Its gonna be HUGE...";wallstreetbets;2021-03-10 15:21:42
gqgcant;Illusive_mustard;8;Come on BB, do something;wallstreetbets;2021-03-10 15:21:41
gqgca8s;a-dead-strawberry;1;"Threw $5300 into GME at $278/share this morning so I can take profits at some point and throw it back into BB. So far my evil plan is going swimmingly.

Yes this is a gamble but it’s only like 3% of my portfolio";stocks;2021-03-10 15:21:37
gqgc5uy;nejekur;1;I finally got some money to put in bb yesterday, and we're higher then $10. Think it'll go lower again or should I just buy here. Those $20 leaps still look good, but could be better;wallstreetbets;2021-03-10 15:20:45
gqgc3rr;Whaty0urname;4;Come on bb, I'm so close dont stop;wallstreetbets;2021-03-10 15:20:32
gqgc3ak;Im_Old_In_Town;3;BB. Keep the momentum!;wallstreetbets;2021-03-10 15:20:29
gqgbydp;photocharge;1;you real fomo'd on that AMC and BB tho! still fair play on the GME win;wallstreetbets;2021-03-10 15:19:48
gqgbusq;Deep-Smile;-1;What about BB guys ? Something is happening or what ?;wallstreetbets;2021-03-10 15:19:02
gqgbq2g;Shawesome_02;1;Past its prime. $BB is looking like the better option;wallstreetbets;2021-03-10 15:18:04
gqgbp0e;arisolo;1;BB only up 2% on a day when things are mooning. If you missed AMC (it’ll drop after earnings) it’s not a bad play at all.;wallstreetbets;2021-03-10 15:17:50
gqgb71i;TheResidentEvil;6;end of January I put 1k into GME, AMC, and bb with most in gme. now my portfolio is worth almost 850. pretty amazing since for a bit there it was worth $150 no lie;wallstreetbets;2021-03-10 15:14:01
gqgb5l6;BIG_PP_ENERGY420;12;Sold my 150 contracts for BB and dumped the entire 15k gain into GME, baby. Fuck these hedge funds;wallstreetbets;2021-03-10 15:13:43
gqgao8e;anthonyngu2;1;I have a lot of money in BB and ICLN for 5 year plays and they’re killing my portfolio and GME is propping it up right now which is kinda ridiculous.;stocks;2021-03-10 15:10:21
gqganpp;saxman234;1;It appears to have been a lump and chump. Think I'll be holding this bag at a lose until I sell. Who knows though, finally taking some profits from most of the January meme stocks (just need BB to get back up a bit).;wallstreetbets;2021-03-10 15:10:14
gqgaj6x;Mason-Derulo;7;Which of you fucks is selling BB;wallstreetbets;2021-03-10 15:09:17
gqga9kp;BrokeDayTrader;2;BB back on its usual shit. Lil POS stock;wallstreetbets;2021-03-10 15:07:14
gqga6y8;FineSkinLeather;8;Just waiting on BB and AAPL to join the show;wallstreetbets;2021-03-10 15:06:40
gqga6uc;Cryptobanian;4;BB needs volume;wallstreetbets;2021-03-10 15:06:39
gqga3jt;JunkMan51;3;Need BB at $18 to get back in the green. Hold you apes!!;wallstreetbets;2021-03-10 15:05:56
gqg9y17;rewq2000;2;BB never fails to dissapoint;wallstreetbets;2021-03-10 15:04:45
gqg9wcg;Shawesome_02;4;"$BB is crazy undervalued right now. I'm jacked to the tits and ready for takeoff. 

$30 minimum by summer easy. 🚀";wallstreetbets;2021-03-10 15:04:23
gqg9v59;TrumpFamilySyndicate;9;"This is really something special. $GME is like a truck on a frozen lake. If it moves to fast, the ice will shatter taking everything down with it. So now we have a driver (HF\* grey hat whales) ""slowly"" taking $GME to the moon. The ripple in front of the $GME truck is all the other shorted stocks that are correlated with the HF black hats being pushed up first so they can cover their losses in GME.

I think we are going to see some major fireworks with all the satellite stocks popping ($KOSS $AMC $BB $NOK etc) before $GME tops off. 

This is absolutely not financial advice. It is barely even a series of complete sentences. 

\*A(HF)AB: All HFs Are Bad";wallstreetbets;2021-03-10 15:04:08
gqg9pla;notnutts;14;AMC and BB looking good today.  I'm almost back to even;wallstreetbets;2021-03-10 15:02:56
gqg9i5y;Tradergurue;6;Can someone tell BB that the market is open?;wallstreetbets;2021-03-10 15:01:19
gqg9eti;Tradergurue;1;I see BB at $20 pre ER.;wallstreetbets;2021-03-10 15:00:37
gqg97eu;Michaelogy;4;BB pleas fly again;wallstreetbets;2021-03-10 14:59:03
gqg93rh;Muted_Idea;4;Any potential for BB to go back to 20+?;wallstreetbets;2021-03-10 14:58:18
gqg8zad;Jeff_Dubya;1;BB, PLTR, NOK all up today too! Erry little bit helps!;wallstreetbets;2021-03-10 14:57:22
gqg8tpd;nta_00;10;GME, BB and PLTR are all mooning today. Fuck yeah;wallstreetbets;2021-03-10 14:56:12
gqg8pzu;tfeqs;2;always bb no ape left behind;wallstreetbets;2021-03-10 14:55:25
gqg8hom;Sandwich_Embarrassed;2;PLUG ME UP BB;wallstreetbets;2021-03-10 14:53:40
gqg8goa;Revolutionary-Foot73;1;Patience daddy. BB tendies are otw;wallstreetbets;2021-03-10 14:53:27
gqg8eeu;AltcoinTraderNy;4;Save BB you golden retards;wallstreetbets;2021-03-10 14:52:57
gqg8c1v;MortalDanger00;1;I've been in BB, GME, RKT, SNDL, TLRY, and APHA.  Sold most at the top.  Once a reddit hits CNBC it rockets up then way back down, then settles on a new, higher, low.  But in this case, I think you're right.  It's not been a huge reddit stock.;wallstreetbets;2021-03-10 14:52:28
gqg895t;Kemilio;6;BB are you fucking kidding me. Every other meme stock is mooning except you;wallstreetbets;2021-03-10 14:51:50
gqg87pz;Myvenom;7;My memefolio consisting of AMC, PLTR, BB, and mostly GME is fucking flying today! God bless you beautiful retards!;wallstreetbets;2021-03-10 14:51:32
gqg8380;Jealous_Balance_7567;1;luv u bb;wallstreetbets;2021-03-10 14:50:34
gqg7vg2;Buy-to-open;0;"$SPY $394c 4/16
$BB $12c 9/23";wallstreetbets;2021-03-10 14:48:56
gqg7tj0;leredditbugman;0;I guess NOK and BB can go fuck themselves frfr;wallstreetbets;2021-03-10 14:48:31
gqg7rms;Tradergurue;1;BB prob gonna do another one of those delicious spikes 🤟🏻;wallstreetbets;2021-03-10 14:48:08
gqg7pun;aka_michael_collins;7;BB why you no get meme love?;wallstreetbets;2021-03-10 14:47:45
gqg7omp;Buy-to-open;3;Bought $BB $12c 9/21 in for the long haul;wallstreetbets;2021-03-10 14:47:30
gqg7lu6;AltcoinTraderNy;3;Is BB going to moon ?;wallstreetbets;2021-03-10 14:46:54
gqg7g13;p00ty916;4;Where my $BB bois at. And when does mother fucking roblox start getting traded. DADDY WANTS IN;wallstreetbets;2021-03-10 14:45:42
gqg77jp;Dad_Bot;3;W H Y BB W H Y;wallstreetbets;2021-03-10 14:43:51
gqg760f;jetatx;1;Let’s have BB close at 11 already! Who hates this so bad that the moment it hits 11 you sell off. Wtf;wallstreetbets;2021-03-10 14:43:30
gqg6ybp;Fistijack61;8;Amc bb Gme🚀🚀🚀;wallstreetbets;2021-03-10 14:41:47
gqg6n77;LongLiveNipsey;1;"I have to stop looking at GME.

Bought at 95$ before the first squeeze, sold at like 70$ after squeeze, and now it's at fuckin $280 and I'm just watching it go skyrocket and hating myself bc I sold at a big loss. Gotdamnit man

Oh well, at least I'm trying to play it smart long term with ARKK, ICLN, and BB now";stocks;2021-03-10 14:39:18
gqg6kh9;SpiritedWrongdoer196;2;14100 itm calls on amc. 10k itm on bb if it hits 11;wallstreetbets;2021-03-10 14:38:41
gqg63rm;_pureguava;1;"picked up AAPL BB ARKF ARKG and BTC yesterday let’s see how we do today

stay green!";stocks;2021-03-10 14:34:53
gqg5q4i;Dakotahray;1;Welp after a couple months I sold BB... to break even.;wallstreetbets;2021-03-10 14:31:50
gqg5fhz;RhinoMan2112;1;Not delusional at all. If you do some DD you'll realize they're a solid company with a solid product and tech. Same for BB.;stocks;2021-03-10 14:29:24
gqg5enk;Tradergurue;1;BB train leaving to tendieland, next stop $50🚀🌕;wallstreetbets;2021-03-10 14:29:13
gqg5e8h;Toastify77;1;AMC, Tesla, BP and BB bois let’s get this bread.;wallstreetbets;2021-03-10 14:29:08
gqg5dam;MadeMeStopLurking;1;"I'm immune to poor stock choices now.    


OH you bought AMC at 17?  No problem.    
Down on your BB positions?  No Sweat.    


Just buy 1 GME, and by morning that little red Total Gains number goes greener than a Tesla rolling downhill (not the stock...  the car)

&amp;#x200B;

This is not financial advice.  I am a pomeranian";wallstreetbets;2021-03-10 14:28:55
gqg4y7y;Core_S;1;BB drones or bust;wallstreetbets;2021-03-10 14:25:28
gqg4cze;Tradergurue;1;Ready for a ride on the BB train to tendieland?;wallstreetbets;2021-03-10 14:20:35
gqg4382;Core_S;1;guys BB gang needs to clang clang together apes strong. lets fuel up and prepare for ape cash aka tendies;wallstreetbets;2021-03-10 14:18:19
gqg3w50;Kanye4President69;1;I can’t wait to see my BB covered calls suck away all my gains at open;wallstreetbets;2021-03-10 14:16:40
gqg3tbo;Thorx99;1;BB looking to soar today 🐦 🦅;wallstreetbets;2021-03-10 14:16:00
gqg3n92;Banzo_;1;BB showing a bugle😳;wallstreetbets;2021-03-10 14:14:32
gqg3j64;lionheart4life;1;BB 30 is not a meme.;wallstreetbets;2021-03-10 14:13:34
gqg395t;gulagula2021;1;Wowwww BB and AMC is following GME to the moon 🚀🛸;wallstreetbets;2021-03-10 14:11:12
gqg32ii;Coryyy_G;2;BB;wallstreetbets;2021-03-10 14:09:37
gqg2sw1;ionized_fallout;1;"07:20 AM EST, 03/10/2021 (MT Newswires) -- Gamestop(GME) shares were up 16% pre-bell Wednesday, continuing their rally of several days, supported by the news of the appointment of Ryan Cohen to lead the company's shift to e-commerce.

Other wallstreetbets Reddit stocks were mixed. AMC (AMC) followed suit trading up 7%, and Blackberry (BB) was up 2%, while Nokia(NOK) was up 2% and Palantir(PLTR) was inching toward 1% up early Wednesday.

Other wallstreetbets Reddit stocks were down Wednesday pre-bell, including Tesla (TSLA) that traded slightly lower and UWMC that was down 1%. Rocket Cos(RKT). (RKT) was also slightly down, and so were Advanced Micro Devices(AMD) and Apple(AAPL) .

Price: 4.0100, Change: +0.05, Percent Change: +1.26


MT Newswires does not provide investment advice. Unauthorized reproduction is strictly prohibited.";wallstreetbets;2021-03-10 14:07:17
gqg2rz6;SpiritedWrongdoer196;2;AMC and BB ready for 🌙 🚀;wallstreetbets;2021-03-10 14:07:03
gqg27ss;Coryyy_G;1;GME + BB 🚀🦧💎🤲🏼;wallstreetbets;2021-03-10 14:02:06
gqg24l7;faustowski;1;bb was the one who fell over;wallstreetbets;2021-03-10 14:01:19
gqg1wzc;Chubbymcgrubby;1;Nah man it ain't wsb anymore it's a bunch of conspiracy theorist who think a premise that was accurate 2 months ago is still accurate. Maybe I'm just a pussy but I also have 40k in leaps between bb and pltr so w/e;wallstreetbets;2021-03-10 13:59:26
gqg1kqd;Mason-Derulo;1;BB looking like it’s breaking out toward an upward trend finally.;wallstreetbets;2021-03-10 13:56:23
gqg1cu9;GorillaNutPuncher;1;BB;wallstreetbets;2021-03-10 13:54:25
gqg101q;BrassMonkey324;1;BB!!!!!!!!!!! 🚀;wallstreetbets;2021-03-10 13:51:15
gqg0zu4;FormerGameDev;1;pltr +2, riot +10, koss +44, bb +5, gme +12 .. gonna be a monster at open;wallstreetbets;2021-03-10 13:51:12
gqg0ttj;BrokeDayTrader;1;BB with 2 consecutive Green Days?! Is this even legal? Leettss gooo;wallstreetbets;2021-03-10 13:49:40
gqg0skj;ihatereddit1221;1;Yes, bb??;wallstreetbets;2021-03-10 13:49:21
gqg0qt2;GorillaNutPuncher;0;BB;wallstreetbets;2021-03-10 13:48:54
gqg0ktw;annoyedboy671;1;10k in bb, 10k in pltr, 10k in f, 10k in weed, 10k in unfi, 20k in penny stocks, 5k in t.  Am I gonna make it;wallstreetbets;2021-03-10 13:47:25
gqg0ks4;Orithegreat;1;BB don't do this to me again be serious this time.;wallstreetbets;2021-03-10 13:47:24
gqg0gj9;remdesivir2020;1;"The gme peeps said they goona pump BB but it was a lie

They nv manage to sell for profit and bagholding all the way";wallstreetbets;2021-03-10 13:46:21
gqfzwuu;zpCrayZ;1;My MVIS and BB calls along with GME shares are looking juicy;wallstreetbets;2021-03-10 13:41:22
gqfzw7f;umbrellacorgi;1;"https://i.imgur.com/AFDO3L1.jpg

Just for you bb 😘";wallstreetbets;2021-03-10 13:41:12
gqfzd2v;criticized;1;$BB too;wallstreetbets;2021-03-10 13:36:16
gqfz4ca;Kanye4President69;1;Really glad I sold my BB calls and sold some covered calls against my BB shares a couple days ago. I’m really excited to have my 600 shares called away @ $12 a month from now after BB goes up like 50%;wallstreetbets;2021-03-10 13:34:00
gqfz0tg;Tradergurue;1;BB = Big balls;wallstreetbets;2021-03-10 13:33:03
gqfz0d2;Im_Old_In_Town;1;Keep up the climb BB!;wallstreetbets;2021-03-10 13:32:56
gqfyfqr;SpiritedWrongdoer196;1;Amc 14100 contracts open at $11. BB over 10k contracts open at $11. Shits gonna squeeze;wallstreetbets;2021-03-10 13:27:23
gqfyf5x;JimBimKim;1;Bro have you thought about swallowing the losses and dumping into GME. I sold BB and NOK for GME yesterday. It's just too good an opportunity to pass up;wallstreetbets;2021-03-10 13:27:13
gqfxwcl;FrgElder;1;"I really want the “what’s the next short squeeze” fad to just die off already. Short interest was almost never mentioned in older DD posts unless it was exceptionally high and there was an obvious positive catalyst in the future that the shorts weren’t taking into account with their bear thesis. I remember seeing it only really related to TSLA before the whole GME ordeal. 

AMC/BB were never short plays, they were just people who FOMO’d after GME skyrocketed and wanted to look for the “next GME” without analyzing the underlying fundamentals of the situation.  Wild price fluctuations in both were simply due to retail investors frenzy. 

I’m long BB and while I find it interesting AMC was able to stave off bankruptcy due to retail investors, I don’t see squeezing or being a good long term investment. The price could fluctuate wildly over the next few months but it will have nothing to do with a short squeeze.";wallstreetbets;2021-03-10 13:21:57
gqfxdi3;The_Pink_Knife;1;I really like BB - could be worth a bomb over the next few years.;wallstreetbets;2021-03-10 13:16:37
gqfx8dw;bowtiewonder;1;I think BB time is about to come. So much consistent good news.;wallstreetbets;2021-03-10 13:15:09
gqfx7q1;bosshax;1;"$BB may open at $11! Huge open interest at $11 which may just keep this thing soaring.   


$NOK up 1% which is basically 1000000% for Nokia. Huge deal everyone going to make a billion cents.   


$RKT gearing up for a huge explosion. Be ahead on this one. HUGE option interest (more than AMC)  


$AMC this thing can go to $20 today.   


$GME we will see 100% today to $500. This will be a level where a lot of people start taking huge gains... Good luck to all.";wallstreetbets;2021-03-10 13:14:59
gqfx65i;coolylame;1; Just started getting into stocks and I would love to invest in gme but with have limited funds. BB is probs my go to;wallstreetbets;2021-03-10 13:14:32
gqfwpks;Mason-Derulo;1;I think BB touched 11 for a second in PM;wallstreetbets;2021-03-10 13:09:47
gqfwl8t;runtimemess;1;BB is a real investment opportunity.;wallstreetbets;2021-03-10 13:08:31
gqfwh7o;AstronautOnly3749;1;BB gang we still here ?;wallstreetbets;2021-03-10 13:07:19
gqfwf1n;WillBeBannedSoon2;1;BB not a meme;wallstreetbets;2021-03-10 13:06:40
gqfwbke;LebronJohns93;1;"You dumb fucks. GME is the play, quit asking about BB, NOK &amp; other stupid shit you got burnt on in January.";wallstreetbets;2021-03-10 13:05:41
gqfwbjv;Tradergurue;1;BB is looking sexy these last couple of days;wallstreetbets;2021-03-10 13:05:40
gqfwa8k;Tradergurue;1;BB goes brrrr 🤑🤑;wallstreetbets;2021-03-10 13:05:17
gqfw8rz;litecoiner;1;BB today?;wallstreetbets;2021-03-10 13:04:51
gqfw82u;coolylame;1;Thoughts on BB?;wallstreetbets;2021-03-10 13:04:39
gqfvmpk;ExtraSourCreamPlease;1;I sold my BB to buy GME;wallstreetbets;2021-03-10 12:58:19
gqfvjce;javeliner10000;1;Will my BB 3/19 15c print? It was worth 1400 at one point and I'm an idiot who bag held;wallstreetbets;2021-03-10 12:57:19
gqfvgij;carlcapo77;1;BB never go Brrr. 🥲;wallstreetbets;2021-03-10 12:56:30
gqfv96s;YakiMe;1;I've got BB bags at 25$.  I remember.;wallstreetbets;2021-03-10 12:54:16
gqfv8jy;Coryyy_G;1;Trust me bro , next week is where things are going to get wierd for BB.;wallstreetbets;2021-03-10 12:54:05
gqfv6by;mtoms48;1;BB = Bounce Back ..lets FKKKKNNNN go 🚀🚀🚀;wallstreetbets;2021-03-10 12:53:24
gqfv3th;fxckwit;1;Remember RKT? SLV? Even fucking BB and AMC are still a bit sus to me, GME is our golden egg boy, we’re not letting him crack;wallstreetbets;2021-03-10 12:52:38
gqfv10j;UpToTheMoon1;1;bb, amc and gme go brrrr;wallstreetbets;2021-03-10 12:51:45
gqfv09p;liquidsyphon;1;Dumped that BB and AMC hot garbage for more GME;wallstreetbets;2021-03-10 12:51:31
gqfuvni;Coryyy_G;1;My 3/19 BB 12.5 Calls are gonna print so hard holy sheet.;wallstreetbets;2021-03-10 12:50:05
gqfuue6;Aliienate;1;"I sold my PLTR calls and my BB calls yesterday thinking i made a good profit. Would be up another like 130% if i held.

Hindsight is a bitch";wallstreetbets;2021-03-10 12:49:41
gqfusxy;Ballsmeetpets;1;Why is bb green pre-market? There must have been a mistake;wallstreetbets;2021-03-10 12:49:13
gqfupxd;heronymou5;1;bb bbrrrr. get in at open;wallstreetbets;2021-03-10 12:48:15
gqfunae;4623897;1;Main contributors to my recovery were BB, RKT, SATS, SKT, ASO, and the big kahuna, GME.;wallstreetbets;2021-03-10 12:47:24
gqfuj5v;NotMe357;1;Woah! BB breaks $11 in Pre-Maket.;wallstreetbets;2021-03-10 12:46:04
gqfui2u;YungBird;2;BB going BRRRRRR??? IS THIS REAL BOIS??;wallstreetbets;2021-03-10 12:45:43
gqfuglk;Ginseng0911;1;Shills pushed AMC, BB, NOK, ect, when GME hit. Some people got fooled, especially new investors, and jumped in on those. Granted some are shorted, so who knows, maybe AMC will moon after GME? I dunno, am ape, lick windows.;wallstreetbets;2021-03-10 12:45:15
gqfughc;WillBeBannedSoon2;1;Okay BB, we see you 👀👀;wallstreetbets;2021-03-10 12:45:12
gqfufxc;chiller_diller;1;BB let’s go🚀🚀🚀;wallstreetbets;2021-03-10 12:45:01
gqfud9b;WillBeBannedSoon2;1;I see good BB news I upvote;wallstreetbets;2021-03-10 12:44:10
gqfucgk;According-Canary-817;1;BB my baby go!;wallstreetbets;2021-03-10 12:43:54
gqfu4wv;Coryyy_G;1; BB 👀🤷🏻‍♂️🚀🚀🚀🚀🚀;wallstreetbets;2021-03-10 12:41:30
gqfu3m7;Pipepoi;1;" $BB🚀🚀🚀

[Tesla Tells California DMV that FSD Is Not Capable of Autonomous Driving (caranddriver.com)](https://www.caranddriver.com/news/a35785277/tesla-fsd-california-self-driving/)

[$BB 🍇 : wallstreetbets (reddit.com)](https://www.reddit.com/r/wallstreetbets/comments/lz61vn/bb/)";wallstreetbets;2021-03-10 12:41:06
gqftzal;WillBeBannedSoon2;1;Aight where this BB megathread at?;wallstreetbets;2021-03-10 12:39:40
gqftypk;itsfineimfinewhy;1;Any serious thoughts of AMC or BB riding GME’s coattails? I sold GME at the top last time and decided to cash out. Wouldn’t mind putting way less money in for small gains, but idk if buying .5 of a GME share is worth it lol.;wallstreetbets;2021-03-10 12:39:28
gqftxl4;eaglesheatchelsea;1;BB is only up because of gme right?;wallstreetbets;2021-03-10 12:39:06
gqftx7j;Im_Old_In_Town;1;BB will be huge in 2-3 years.;wallstreetbets;2021-03-10 12:38:59
gqftlyl;tipma;1;BB RUNNING;wallstreetbets;2021-03-10 12:35:22
gqftj5v;WillBeBannedSoon2;1;BB rally? BB RALLY? BB RALLY?!!!!;wallstreetbets;2021-03-10 12:34:27
gqfti81;norafromqueens;1;Could today be the day I let go of some BB bags? :P;stocks;2021-03-10 12:34:09
gqfta3s;Spongefob62;1;BB please fly again 😂;wallstreetbets;2021-03-10 12:31:29
gqfszgw;Tradergurue;1;BAG - BB, AMC, GME;wallstreetbets;2021-03-10 12:28:01
gqfs141;UpperPaleolithic;1;BB is the hamster filming, thinking he's better then everyone.;wallstreetbets;2021-03-10 12:16:29
gqfrzb3;AudensAvidius;1;Love u bb;wallstreetbets;2021-03-10 12:15:52
gqfrz1z;WSBNon-Believer;1;I hopped on the BB train fuck it;wallstreetbets;2021-03-10 12:15:47
gqfr8ht;Erenio69;1;BB is becoming such a boomer stock🤦🏼‍♂️;wallstreetbets;2021-03-10 12:06:38
gqfqpoz;WillBeBannedSoon2;1;BB got some good news yesterday, so they’ll probably be down;wallstreetbets;2021-03-10 11:59:53
gqfpvzv;lookshee;1;"That's the point tho right? All BB gang talks about is BB. Same with AMC.

That's what this thread is for, discussing the day's focus.";wallstreetbets;2021-03-10 11:48:47
gqfpfs1;Tradergurue;1;BB doing just fine 😏;wallstreetbets;2021-03-10 11:42:37
gqfok1w;belangrijke_muis;1;Never imagined I'd consider the possibility that my $12 BB covered call would actually be exercised. Considering I bought in at $9.43 I guess I can't be too mad if it happens;stocks;2021-03-10 11:30:06
gqfoe76;Shawesome_02;1;$BB + $RBLX = 🚀🚀;wallstreetbets;2021-03-10 11:27:44
gqfo1ib;gcjrentals;1;Bro called it a pump and dump....I call it a long hold etf amc, bb, gme, expr, rkt, apph (apph because it feels good to stand behind a company that stands behind the people)... not financial advice;wallstreetbets;2021-03-10 11:22:30
gqfo18i;Kledd;1;"BB is doing it

2 day green streak";wallstreetbets;2021-03-10 11:22:23
gqfn9hn;industriousness;1;Should I sell AMC and BB (I’ve made serious losses on both) and invest the proceeds in GME?;wallstreetbets;2021-03-10 11:11:02
